[
  {
    "id": "bank_b2_001",
    "tag_id": "konjunktiv_i_indirekte_rede",
    "topic_id": "konjunktiv_i_indirekte_rede",
    "dimension": "grammar",
    "type": "cloze_cued",
    "cefr": "B2",
    "difficulty": 3,
    "prompt": "Die Sprecherin teilte mit, der Minister ___ heute zurückgetreten. (sein)",
    "cue": "sein",
    "accepted_answers": [
      "sei"
    ],
    "distractors": [
      {
        "text": "ist",
        "implied_topic_id": "verb_sein_haben"
      },
      {
        "text": "wäre",
        "implied_topic_id": "konjunktiv_ii_irreal_gegenwart"
      },
      {
        "text": "war",
        "implied_topic_id": "praeteritum_sein_haben_modal"
      }
    ],
    "rule_hint": "Indirekte Rede in der 3. Person Singular verlangt Konjunktiv I (sei).",
    "block_id": null,
    "block_position": null,
    "confusion_group": null,
    "facet": null,
    "carrier_lemmas": [
      "Minister",
      "Sprecherin",
      "mitteilen",
      "zurücktreten"
    ],
    "domain": null,
    "source_sentence_id": null
  }
]