[
  {
    "id": "bank_sample_004",
    "topic_id": "artikel_unbestimmt_kein_nom",
    "tag_id": "artikel_unbestimmt_kein_nom",
    "dimension": "grammar",
    "type": "cloze_free",
    "difficulty": 1,
    "cefr": "A1",
    "prompt": "Hier steht ___ Auto.",
    "accepted_answers": [
      "ein"
    ],
    "distractors": [
      {
        "text": "eine",
        "implied_topic_id": null,
        "misconception": null
      },
      {
        "text": "einen",
        "implied_topic_id": null,
        "misconception": null
      },
      {
        "text": "einem",
        "implied_topic_id": null,
        "misconception": null
      }
    ],
    "cue": null,
    "rule_hint": null,
    "facet": "Gender=Unk|Number=Sing",
    "confusion_group": "artikelwoerter",
    "block_id": null,
    "block_position": null,
    "domain": "general",
    "carrier_lemmas": [],
    "source_sentence_id": null
  }
]