[
  {
    "id": "bank_sample_007",
    "topic_id": "nebensatz_weil_da",
    "tag_id": "nebensatz_weil_da",
    "dimension": "grammar",
    "type": "cloze_free",
    "difficulty": 2,
    "cefr": "B1",
    "prompt": "Er bleibt hier, weil er müde ___.",
    "accepted_answers": [
      "ist"
    ],
    "distractors": [
      {
        "text": "war",
        "implied_topic_id": null,
        "misconception": null
      },
      {
        "text": "sein",
        "implied_topic_id": null,
        "misconception": null
      },
      {
        "text": "wäre",
        "implied_topic_id": null,
        "misconception": null
      }
    ],
    "cue": null,
    "rule_hint": null,
    "facet": null,
    "confusion_group": "nebensatz_konnektoren",
    "block_id": null,
    "block_position": null,
    "domain": "general",
    "carrier_lemmas": [],
    "source_sentence_id": null
  }
]