[
  {
    "id": "bank_a2_002",
    "tag_id": "akkusativ_nach_praeposition",
    "topic_id": "akkusativ_nach_praeposition",
    "dimension": "grammar",
    "type": "cloze_free",
    "cefr": "A2",
    "difficulty": 1,
    "prompt": "Er legt das Buch auf ___ Tisch.",
    "cue": null,
    "accepted_answers": [
      "den"
    ],
    "distractors": [
      {
        "text": "dem",
        "implied_topic_id": "kasus_dativ_formen"
      },
      {
        "text": "des",
        "implied_topic_id": "kasus_genitiv_formen"
      },
      {
        "text": "das",
        "implied_topic_id": "artikel_bestimmt_nom"
      }
    ],
    "rule_hint": "Wechselpräposition auf + Akkusativ bei Richtung (Wohin?).",
    "block_id": null,
    "block_position": null,
    "confusion_group": null,
    "facet": null,
    "carrier_lemmas": [
      "Buch",
      "Tisch",
      "legen"
    ],
    "domain": null,
    "source_sentence_id": null
  },
  {
    "id": "bank_a2_001",
    "tag_id": "dativ_nach_praeposition",
    "topic_id": "dativ_nach_praeposition",
    "dimension": "grammar",
    "type": "cloze_free",
    "cefr": "A2",
    "difficulty": 1,
    "prompt": "Das Buch liegt auf ___ Tisch.",
    "cue": null,
    "accepted_answers": [
      "dem"
    ],
    "distractors": [
      {
        "text": "den",
        "implied_topic_id": "kasus_akkusativ_formen"
      },
      {
        "text": "des",
        "implied_topic_id": "kasus_genitiv_formen"
      },
      {
        "text": "das",
        "implied_topic_id": "artikel_bestimmt_nom"
      }
    ],
    "rule_hint": "Wechselpräposition auf + Dativ bei statischer Ortsangabe (Wo?).",
    "block_id": null,
    "block_position": null,
    "confusion_group": null,
    "facet": null,
    "carrier_lemmas": [
      "Buch",
      "Tisch",
      "liegen"
    ],
    "domain": null,
    "source_sentence_id": null
  },
  {
    "id": "bank_b2_001",
    "tag_id": "konjunktiv_i_indirekte_rede",
    "topic_id": "konjunktiv_i_indirekte_rede",
    "dimension": "grammar",
    "type": "cloze_cued",
    "cefr": "B2",
    "difficulty": 3,
    "prompt": "Die Sprecherin teilte mit, der Minister ___ heute zurückgetreten. (sein)",
    "cue": "sein",
    "accepted_answers": [
      "sei"
    ],
    "distractors": [
      {
        "text": "ist",
        "implied_topic_id": "verb_sein_haben"
      },
      {
        "text": "wäre",
        "implied_topic_id": "konjunktiv_ii_irreal_gegenwart"
      },
      {
        "text": "war",
        "implied_topic_id": "praeteritum_sein_haben_modal"
      }
    ],
    "rule_hint": "Indirekte Rede in der 3. Person Singular verlangt Konjunktiv I (sei).",
    "block_id": null,
    "block_position": null,
    "confusion_group": null,
    "facet": null,
    "carrier_lemmas": [
      "Minister",
      "Sprecherin",
      "mitteilen",
      "zurücktreten"
    ],
    "domain": null,
    "source_sentence_id": null
  },
  {
    "id": "bank_b1_002",
    "tag_id": "konjunktiv_ii_irreal_gegenwart",
    "topic_id": "konjunktiv_ii_irreal_gegenwart",
    "dimension": "grammar",
    "type": "cloze_cued",
    "cefr": "B1",
    "difficulty": 2,
    "prompt": "Wenn ich mehr Zeit hätte, ___ ich gerne öfter reisen. (würde)",
    "cue": "würde",
    "accepted_answers": [
      "würde"
    ],
    "distractors": [
      {
        "text": "werde",
        "implied_topic_id": "futur_i"
      },
      {
        "text": "wurde",
        "implied_topic_id": "passiv_praeteritum"
      },
      {
        "text": "wäre",
        "implied_topic_id": "konjunktiv_ii_irreal_gegenwart"
      }
    ],
    "rule_hint": "Konjunktiv II Gegenwart: würde-Ersatzform + Infinitiv.",
    "block_id": null,
    "block_position": null,
    "confusion_group": null,
    "facet": null,
    "carrier_lemmas": [
      "Zeit",
      "haben",
      "reisen",
      "öfter"
    ],
    "domain": null,
    "source_sentence_id": null
  },
  {
    "id": "bank_b1_001",
    "tag_id": "nebensatz_weil_da",
    "topic_id": "nebensatz_weil_da",
    "dimension": "grammar",
    "type": "cloze_free",
    "cefr": "B1",
    "difficulty": 2,
    "prompt": "Ich bleibe heute zu Hause, ___ ich erkältet bin.",
    "cue": null,
    "accepted_answers": [
      "weil",
      "da"
    ],
    "distractors": [
      {
        "text": "denn",
        "implied_topic_id": "konjunktionen_position_0"
      },
      {
        "text": "deshalb",
        "implied_topic_id": "diskurs_adverbialanschluss"
      },
      {
        "text": "obwohl",
        "implied_topic_id": "nebensatz_obwohl_trotzdem"
      }
    ],
    "rule_hint": "Kausale Nebensätze mit 'weil' oder 'da' schicken das konjugierte Verb ans Satzende.",
    "block_id": null,
    "block_position": null,
    "confusion_group": null,
    "facet": null,
    "carrier_lemmas": [
      "Hause",
      "bleiben",
      "erkältet",
      "heute"
    ],
    "domain": null,
    "source_sentence_id": null
  },
  {
    "id": "bank_b2_002",
    "tag_id": "passiversatz_erweitert_b2",
    "topic_id": "passiversatz_erweitert_b2",
    "dimension": "grammar",
    "type": "cloze_free",
    "cefr": "B2",
    "difficulty": 3,
    "prompt": "Dieses schwierige Problem lässt ___ nicht ohne Weiteres lösen.",
    "cue": null,
    "accepted_answers": [
      "sich"
    ],
    "distractors": [
      {
        "text": "es",
        "implied_topic_id": "pronomen_personal_nom"
      },
      {
        "text": "uns",
        "implied_topic_id": "pronomen_personal_dat"
      },
      {
        "text": "ihm",
        "implied_topic_id": "pronomen_personal_dat"
      }
    ],
    "rule_hint": "Passiversatz: sich lassen + Infinitiv drückt eine passive Möglichkeit aus.",
    "block_id": null,
    "block_position": null,
    "confusion_group": null,
    "facet": null,
    "carrier_lemmas": [
      "Problem",
      "lassen",
      "lösen",
      "schwierig"
    ],
    "domain": null,
    "source_sentence_id": null
  },
  {
    "id": "bank_a1_001",
    "tag_id": "pronomen_personal_nom",
    "topic_id": "pronomen_personal_nom",
    "dimension": "grammar",
    "type": "cloze_free",
    "cefr": "A1",
    "difficulty": 1,
    "prompt": "___ heiße Max und komme aus Deutschland.",
    "cue": null,
    "accepted_answers": [
      "Ich",
      "ich"
    ],
    "distractors": [
      {
        "text": "Du",
        "implied_topic_id": "pronomen_personal_nom"
      },
      {
        "text": "Er",
        "implied_topic_id": "pronomen_personal_nom"
      },
      {
        "text": "Wir",
        "implied_topic_id": "pronomen_personal_nom"
      }
    ],
    "rule_hint": "Subjekt in der 1. Person Singular ist 'ich'.",
    "block_id": null,
    "block_position": null,
    "confusion_group": null,
    "facet": null,
    "carrier_lemmas": [
      "Deutschland",
      "heißen",
      "kommen"
    ],
    "domain": null,
    "source_sentence_id": null
  },
  {
    "id": "bank_a1_002",
    "tag_id": "verb_praesens_regelm",
    "topic_id": "verb_praesens_regelm",
    "dimension": "grammar",
    "type": "cloze_cued",
    "cefr": "A1",
    "difficulty": 1,
    "prompt": "Er ___ jeden Tag im Büro. (arbeiten)",
    "cue": "arbeiten",
    "accepted_answers": [
      "arbeitet"
    ],
    "distractors": [
      {
        "text": "arbeite",
        "implied_topic_id": "verb_praesens_regelm"
      },
      {
        "text": "arbeitest",
        "implied_topic_id": "verb_praesens_regelm"
      },
      {
        "text": "arbeiten",
        "implied_topic_id": "verb_praesens_regelm"
      }
    ],
    "rule_hint": "Endung bei 'er/sie/es' im Präsens ist '-t' bzw. '-et' nach d/t.",
    "block_id": null,
    "block_position": null,
    "confusion_group": null,
    "facet": null,
    "carrier_lemmas": [
      "Büro",
      "Tag",
      "arbeiten",
      "jeder"
    ],
    "domain": null,
    "source_sentence_id": null
  }
]