[
  {
    "id": "bank_sample_008",
    "topic_id": "konjunktiv_ii_irreal_gegenwart",
    "tag_id": "konjunktiv_ii_irreal_gegenwart",
    "dimension": "grammar",
    "type": "cloze_free",
    "difficulty": 3,
    "cefr": "B1",
    "prompt": "Wenn ich reich ___, würde ich reisen.",
    "accepted_answers": [
      "wäre"
    ],
    "distractors": [
      {
        "text": "war",
        "implied_topic_id": null,
        "misconception": null
      },
      {
        "text": "bin",
        "implied_topic_id": null,
        "misconception": null
      },
      {
        "text": "sei",
        "implied_topic_id": null,
        "misconception": null
      }
    ],
    "cue": null,
    "rule_hint": null,
    "facet": "Number=Sing|Person=Unk",
    "confusion_group": "konjunktiv",
    "block_id": null,
    "block_position": null,
    "domain": "general",
    "carrier_lemmas": [],
    "source_sentence_id": null
  }
]