[
  {
    "id": "bank_sample_001",
    "topic_id": "pronomen_personal_nom",
    "tag_id": "pronomen_personal_nom",
    "dimension": "grammar",
    "type": "cloze_free",
    "difficulty": 1,
    "cefr": "A1",
    "prompt": "___ heiße Max.",
    "accepted_answers": [
      "Ich"
    ],
    "distractors": [
      {
        "text": "Du",
        "implied_topic_id": null,
        "misconception": null
      },
      {
        "text": "Er",
        "implied_topic_id": null,
        "misconception": null
      },
      {
        "text": "Wir",
        "implied_topic_id": null,
        "misconception": null
      }
    ],
    "cue": null,
    "rule_hint": null,
    "facet": "Gender=Unk|Number=Sing|Person=1",
    "confusion_group": "personalpronomen_kasus",
    "block_id": null,
    "block_position": null,
    "domain": "general",
    "carrier_lemmas": [],
    "source_sentence_id": null
  }
]