[
  {
    "id": "bank_sample_003",
    "topic_id": "artikel_bestimmt_nom",
    "tag_id": "artikel_bestimmt_nom",
    "dimension": "grammar",
    "type": "cloze_free",
    "difficulty": 1,
    "cefr": "A1",
    "prompt": "___ Tisch ist groß.",
    "accepted_answers": [
      "Der"
    ],
    "distractors": [
      {
        "text": "Die",
        "implied_topic_id": null,
        "misconception": null
      },
      {
        "text": "Das",
        "implied_topic_id": null,
        "misconception": null
      },
      {
        "text": "Den",
        "implied_topic_id": null,
        "misconception": null
      }
    ],
    "cue": null,
    "rule_hint": null,
    "facet": "Gender=Masc|Number=Sing",
    "confusion_group": "artikelwoerter",
    "block_id": null,
    "block_position": null,
    "domain": "general",
    "carrier_lemmas": [],
    "source_sentence_id": null
  }
]