[
  {
    "id": "bank_sample_006",
    "topic_id": "akkusativ_nach_praeposition",
    "tag_id": "akkusativ_nach_praeposition",
    "dimension": "grammar",
    "type": "cloze_free",
    "difficulty": 2,
    "cefr": "A2",
    "prompt": "Wir gehen durch ___ Park.",
    "accepted_answers": [
      "den"
    ],
    "distractors": [
      {
        "text": "dem",
        "implied_topic_id": null,
        "misconception": null
      },
      {
        "text": "das",
        "implied_topic_id": null,
        "misconception": null
      },
      {
        "text": "des",
        "implied_topic_id": null,
        "misconception": null
      }
    ],
    "cue": null,
    "rule_hint": null,
    "facet": "Definite=Def|Gender=Masc|Number=Sing",
    "confusion_group": "kasus_wechselpraeposition",
    "block_id": null,
    "block_position": null,
    "domain": "general",
    "carrier_lemmas": [],
    "source_sentence_id": null
  }
]