[
  {
    "id": "bank_b2_002",
    "tag_id": "passiversatz_erweitert_b2",
    "topic_id": "passiversatz_erweitert_b2",
    "dimension": "grammar",
    "type": "cloze_free",
    "cefr": "B2",
    "difficulty": 3,
    "prompt": "Dieses schwierige Problem lässt ___ nicht ohne Weiteres lösen.",
    "cue": null,
    "accepted_answers": [
      "sich"
    ],
    "distractors": [
      {
        "text": "es",
        "implied_topic_id": "pronomen_personal_nom"
      },
      {
        "text": "uns",
        "implied_topic_id": "pronomen_personal_dat"
      },
      {
        "text": "ihm",
        "implied_topic_id": "pronomen_personal_dat"
      }
    ],
    "rule_hint": "Passiversatz: sich lassen + Infinitiv drückt eine passive Möglichkeit aus.",
    "block_id": null,
    "block_position": null,
    "confusion_group": null,
    "facet": null,
    "carrier_lemmas": [
      "Problem",
      "lassen",
      "lösen",
      "schwierig"
    ],
    "domain": null,
    "source_sentence_id": null
  }
]